{
 "drivers": [
  {
   "channels": 2,
   "continuous_current_a": 6.5,
   "efficiency": 0.92,
   "input_range_v": [
    9.0,
    30.0
   ],
   "part_id": "TK-2C10",
   "peak_current_a": 10.0,
   "price_usd": 34.0,
   "vendor": "TK"
  },
  {
   "channels": 2,
   "continuous_current_a": 7.0,
   "efficiency": 0.92,
   "input_range_v": [
    9.0,
    30.0
   ],
   "part_id": "TK-2C14",
   "peak_current_a": 14.0,
   "price_usd": 41.0,
   "vendor": "TK"
  },
  {
   "channels": 2,
   "continuous_current_a": 10.0,
   "efficiency": 0.92,
   "input_range_v": [
    9.0,
    30.0
   ],
   "part_id": "TK-2C20",
   "peak_current_a": 20.0,
   "price_usd": 52.0,
   "vendor": "TK"
  },
  {
   "channels": 2,
   "continuous_current_a": 7.0,
   "efficiency": 0.92,
   "input_range_v": [
    18.0,
    48.0
   ],
   "part_id": "TK-2C14H",
   "peak_current_a": 14.0,
   "price_usd": 47.0,
   "vendor": "TK"
  }
 ],
 "errata": [
  {
   "as_printed": "the WD-R52-72 page plots the WD-R52-82 curves",
   "correct": "the specification table governs",
   "field": "curves",
   "item": "WD-1",
   "part_id": "WD-R52-72",
   "sheet": "DS-errata-WD-2026-09"
  },
  {
   "as_printed": 4.5,
   "correct": 4.0,
   "field": "capacity_ah",
   "item": "AC-1",
   "part_id": "AC-6S-40",
   "sheet": "DS-errata-AC-2026-08"
  },
  {
   "as_printed": 12.0,
   "correct": 10.0,
   "field": "peak_current_a",
   "item": "TK-1",
   "part_id": "TK-2C10",
   "sheet": "DS-errata-TK-2026-07"
  }
 ],
 "format": "quad-catalogue/1",
 "housing_classes": {
  "R38": {
   "bolt": "M3",
   "bolt_circle_m": 0.044,
   "bolts": 3,
   "can_diameter_m": 0.038,
   "can_length_m": 0.058,
   "flange_diameter_m": 0.05,
   "flange_thickness_m": 0.003
  },
  "R52": {
   "bolt": "M3",
   "bolt_circle_m": 0.06,
   "bolts": 4,
   "can_diameter_m": 0.052,
   "can_length_m": 0.046,
   "flange_diameter_m": 0.066,
   "flange_thickness_m": 0.003
  },
  "R62": {
   "bolt": "M4",
   "bolt_circle_m": 0.07,
   "bolts": 4,
   "can_diameter_m": 0.062,
   "can_length_m": 0.042,
   "flange_diameter_m": 0.076,
   "flange_thickness_m": 0.003
  }
 },
 "hubs": [
  {
   "input_range_v": [
    9.0,
    48.0
   ],
   "part_id": "TK-HB6",
   "ports": 6,
   "price_usd": 38.0,
   "vendor": "TK"
  }
 ],
 "modules": [
  {
   "continuous_torque_nm": 1.75,
   "headline": "3 N m class",
   "housing_class": "R52",
   "lead_time": "stock",
   "mass_kg": 0.178,
   "output_inertia_kg_m2": 0.0021,
   "part_id": "WD-R52-32",
   "phase_resistance_ohm": 0.32,
   "points": [
    {
     "no_load_speed_rad_s": 27.227136331111538,
     "peak_current_a": 9.0,
     "peak_torque_nm": 3.2,
     "voltage_v": 24.0
    },
    {
     "no_load_speed_rad_s": 40.21238596594935,
     "peak_current_a": 9.0,
     "peak_torque_nm": 3.3,
     "voltage_v": 36.0
    }
   ],
   "price_usd": 61.0,
   "title": "Actuator module",
   "vendor": "WD",
   "voltage_range_v": [
    16.0,
    44.0
   ]
  },
  {
   "continuous_torque_nm": 2.0,
   "headline": "3.5 N m class",
   "housing_class": "R52",
   "lead_time": "stock",
   "mass_kg": 0.188,
   "output_inertia_kg_m2": 0.0024,
   "part_id": "WD-R52-37",
   "phase_resistance_ohm": 0.3,
   "points": [
    {
     "no_load_speed_rad_s": 25.656340004316643,
     "peak_current_a": 9.5,
     "peak_torque_nm": 3.7,
     "voltage_v": 24.0
    },
    {
     "no_load_speed_rad_s": 37.90855135331684,
     "peak_current_a": 9.5,
     "peak_torque_nm": 3.8,
     "voltage_v": 36.0
    }
   ],
   "price_usd": 66.0,
   "title": "Actuator module",
   "vendor": "WD",
   "voltage_range_v": [
    16.0,
    44.0
   ]
  },
  {
   "continuous_torque_nm": 2.3,
   "headline": "4 N m class",
   "housing_class": "R52",
   "lead_time": "stock",
   "mass_kg": 0.198,
   "output_inertia_kg_m2": 0.0027,
   "part_id": "WD-R52-42",
   "phase_resistance_ohm": 0.28,
   "points": [
    {
     "no_load_speed_rad_s": 24.085543677521745,
     "peak_current_a": 10.0,
     "peak_torque_nm": 4.2,
     "voltage_v": 24.0
    },
    {
     "no_load_speed_rad_s": 35.60471674068432,
     "peak_current_a": 10.0,
     "peak_torque_nm": 4.3,
     "voltage_v": 36.0
    }
   ],
   "price_usd": 71.5,
   "title": "Actuator module",
   "vendor": "WD",
   "voltage_range_v": [
    16.0,
    44.0
   ]
  },
  {
   "continuous_torque_nm": 2.62,
   "headline": "5 N m class",
   "housing_class": "R52",
   "lead_time": "stock",
   "mass_kg": 0.21,
   "output_inertia_kg_m2": 0.0031,
   "part_id": "WD-R52-48",
   "phase_resistance_ohm": 0.26,
   "points": [
    {
     "no_load_speed_rad_s": 22.51474735072685,
     "peak_current_a": 10.5,
     "peak_torque_nm": 4.8,
     "voltage_v": 24.0
    },
    {
     "no_load_speed_rad_s": 33.3008821280518,
     "peak_current_a": 10.5,
     "peak_torque_nm": 4.9,
     "voltage_v": 36.0
    }
   ],
   "price_usd": 77.5,
   "title": "Actuator module",
   "vendor": "WD",
   "voltage_range_v": [
    16.0,
    44.0
   ]
  },
  {
   "continuous_torque_nm": 3.0,
   "headline": "5.5 N m class",
   "housing_class": "R52",
   "lead_time": "stock",
   "mass_kg": 0.224,
   "output_inertia_kg_m2": 0.0035,
   "part_id": "WD-R52-55",
   "phase_resistance_ohm": 0.24,
   "points": [
    {
     "no_load_speed_rad_s": 20.94395102393195,
     "peak_current_a": 11.0,
     "peak_torque_nm": 5.5,
     "voltage_v": 24.0
    },
    {
     "no_load_speed_rad_s": 30.99704751541929,
     "peak_current_a": 11.0,
     "peak_torque_nm": 5.6,
     "voltage_v": 36.0
    }
   ],
   "price_usd": 84.0,
   "title": "Actuator module",
   "vendor": "WD",
   "voltage_range_v": [
    16.0,
    44.0
   ]
  },
  {
   "continuous_torque_nm": 3.42,
   "headline": "6.5 N m class",
   "housing_class": "R52",
   "lead_time": "stock",
   "mass_kg": 0.24,
   "output_inertia_kg_m2": 0.004,
   "part_id": "WD-R52-63",
   "phase_resistance_ohm": 0.22,
   "points": [
    {
     "no_load_speed_rad_s": 19.687313962496034,
     "peak_current_a": 11.5,
     "peak_torque_nm": 6.3,
     "voltage_v": 24.0
    },
    {
     "no_load_speed_rad_s": 29.112091923265414,
     "peak_current_a": 11.5,
     "peak_torque_nm": 6.4,
     "voltage_v": 36.0
    }
   ],
   "price_usd": 91.0,
   "title": "Actuator module",
   "vendor": "WD",
   "voltage_range_v": [
    16.0,
    44.0
   ]
  },
  {
   "continuous_torque_nm": 3.9,
   "headline": "7 N m class",
   "housing_class": "R52",
   "lead_time": "stock",
   "mass_kg": 0.258,
   "output_inertia_kg_m2": 0.0046,
   "part_id": "WD-R52-72",
   "phase_resistance_ohm": 0.21,
   "points": [
    {
     "no_load_speed_rad_s": 18.430676901060117,
     "peak_current_a": 12.0,
     "peak_torque_nm": 7.2,
     "voltage_v": 24.0
    },
    {
     "no_load_speed_rad_s": 27.227136331111538,
     "peak_current_a": 12.0,
     "peak_torque_nm": 7.3,
     "voltage_v": 36.0
    }
   ],
   "price_usd": 98.5,
   "title": "Actuator module",
   "vendor": "WD",
   "voltage_range_v": [
    16.0,
    44.0
   ]
  },
  {
   "continuous_torque_nm": 4.45,
   "headline": "8 N m class",
   "housing_class": "R52",
   "lead_time": "stock",
   "mass_kg": 0.278,
   "output_inertia_kg_m2": 0.0053,
   "part_id": "WD-R52-82",
   "phase_resistance_ohm": 0.2,
   "points": [
    {
     "no_load_speed_rad_s": 17.27875959474386,
     "peak_current_a": 12.5,
     "peak_torque_nm": 8.2,
     "voltage_v": 24.0
    },
    {
     "no_load_speed_rad_s": 25.551620249196983,
     "peak_current_a": 12.5,
     "peak_torque_nm": 8.3,
     "voltage_v": 36.0
    }
   ],
   "price_usd": 106.0,
   "title": "Actuator module",
   "vendor": "WD",
   "voltage_range_v": [
    16.0,
    44.0
   ]
  },
  {
   "continuous_torque_nm": 5.05,
   "headline": "9.5 N m class",
   "housing_class": "R52",
   "lead_time": "stock",
   "mass_kg": 0.3,
   "output_inertia_kg_m2": 0.0061,
   "part_id": "WD-R52-94",
   "phase_resistance_ohm": 0.19,
   "points": [
    {
     "no_load_speed_rad_s": 16.126842288427603,
     "peak_current_a": 13.0,
     "peak_torque_nm": 9.4,
     "voltage_v": 24.0
    },
    {
     "no_load_speed_rad_s": 23.876104167282428,
     "peak_current_a": 13.0,
     "peak_torque_nm": 9.5,
     "voltage_v": 36.0
    }
   ],
   "price_usd": 131.0,
   "title": "Actuator module",
   "vendor": "WD",
   "voltage_range_v": [
    16.0,
    44.0
   ]
  },
  {
   "continuous_torque_nm": 5.8,
   "headline": "11 N m class",
   "housing_class": "R52",
   "lead_time": "stock",
   "mass_kg": 0.322,
   "output_inertia_kg_m2": 0.007,
   "part_id": "WD-R52-108",
   "phase_resistance_ohm": 0.18,
   "points": [
    {
     "no_load_speed_rad_s": 15.079644737231007,
     "peak_current_a": 13.5,
     "peak_torque_nm": 10.8,
     "voltage_v": 24.0
    },
    {
     "no_load_speed_rad_s": 22.30530784048753,
     "peak_current_a": 13.5,
     "peak_torque_nm": 10.9,
     "voltage_v": 36.0
    }
   ],
   "price_usd": 139.0,
   "title": "Actuator module",
   "vendor": "WD",
   "voltage_range_v": [
    16.0,
    44.0
   ]
  },
  {
   "continuous_torque_nm": 3.3,
   "headline": "8 N m class",
   "housing_class": "R52",
   "lead_time": "stock",
   "mass_kg": 0.262,
   "output_inertia_kg_m2": 0.0098,
   "part_id": "WD-R52-80G",
   "phase_resistance_ohm": 0.3,
   "points": [
    {
     "no_load_speed_rad_s": 12.356931104119852,
     "peak_current_a": 9.0,
     "peak_torque_nm": 8.0,
     "voltage_v": 24.0
    },
    {
     "no_load_speed_rad_s": 18.2212373908208,
     "peak_current_a": 9.0,
     "peak_torque_nm": 8.0,
     "voltage_v": 36.0
    }
   ],
   "price_usd": 92.0,
   "title": "Actuator module, high-ratio",
   "vendor": "WD",
   "voltage_range_v": [
    16.0,
    44.0
   ]
  },
  {
   "continuous_torque_nm": 3.8,
   "headline": "6 N m class",
   "housing_class": "R52",
   "lead_time": "stock",
   "mass_kg": 0.262,
   "output_inertia_kg_m2": 0.0038,
   "part_id": "WD-R52-60T",
   "phase_resistance_ohm": 0.21,
   "points": [
    {
     "no_load_speed_rad_s": 20.106192982974676,
     "peak_current_a": 11.5,
     "peak_torque_nm": 6.0,
     "voltage_v": 24.0
    },
    {
     "no_load_speed_rad_s": 29.740410453983372,